{"$defs":{"absolutePath":{"pattern":"^/(?:[A-Za-z0-9._+-]+/)*[A-Za-z0-9._+-]+$","type":"string"},"digest":{"pattern":"^[0-9a-f]{64}$","type":"string"},"digestRef":{"additionalProperties":false,"properties":{"id":{"$ref":"#/$defs/id"},"sha256":{"$ref":"#/$defs/digest"}},"required":["id","sha256"],"type":"object"},"hex32":{"pattern":"^[0-9a-f]{32}$","type":"string"},"hex40":{"pattern":"^[0-9a-f]{40}$","type":"string"},"id":{"pattern":"^[a-z0-9][a-z0-9._-]{0,63}$","type":"string"},"licenseRef":{"additionalProperties":false,"properties":{"decision":{"enum":["affirmative","informational","restricted","user-supplied"]},"id":{"$ref":"#/$defs/id"},"text_sha256":{"$ref":"#/$defs/digest"}},"required":["id","text_sha256","decision"],"type":"object"},"path":{"not":{"pattern":"(?:^|/)(?:\\.|\\.\\.)(?:/|$)|//"},"pattern":"^[a-z0-9][a-z0-9._/-]{0,255}$","type":"string"},"positive":{"maximum":9223372036854775807,"minimum":1,"type":"integer"},"resourcePath":{"not":{"pattern":"(?:^|/)(?:\\.|\\.\\.)(?:/|$)|//"},"pattern":"^[A-Za-z0-9][A-Za-z0-9._/-]{0,255}$","type":"string"},"s64":{"maximum":9223372036854775807,"minimum":0,"type":"integer"},"systemRef":{"additionalProperties":false,"properties":{"id":{"$ref":"#/$defs/id"},"manifest_sha256":{"$ref":"#/$defs/digest"}},"required":["id","manifest_sha256"],"type":"object"},"text":{"maxLength":4096,"minLength":1,"type":"string"},"textMaybeEmpty":{"maxLength":4096,"type":"string"},"u32":{"maximum":4294967295,"minimum":0,"type":"integer"},"u64":{"maximum":18446744073709551615,"minimum":0,"type":"integer"}},"$id":"kilix.content.sandbox-profile/v1","$schema":"https://json-schema.org/draft/2020-12/schema","additionalProperties":false,"properties":{"capabilities":{"items":{"type":"string"},"maxItems":0,"type":"array","uniqueItems":true},"devices":{"const":["/dev/null","/dev/random","/dev/urandom","/dev/zero"],"type":"array"},"id":{"$ref":"#/$defs/id"},"mounts":{"items":{"additionalProperties":false,"properties":{"kind":{"enum":["bind","proc","tmpfs"]},"nodev":{"type":"boolean"},"noexec":{"type":"boolean"},"nosuid":{"type":"boolean"},"read_only":{"type":"boolean"},"source_role":{"$ref":"#/$defs/id"},"target":{"$ref":"#/$defs/absolutePath"}},"required":["source_role","target","kind","read_only","noexec","nosuid","nodev"],"type":"object"},"maxItems":128,"minItems":1,"type":"array","uniqueItems":true},"namespaces":{"additionalProperties":false,"properties":{"ipc":{"const":"fresh"},"mount":{"const":"fresh"},"network":{"const":"fresh"},"pid":{"const":"fresh"},"user":{"const":"fresh"}},"required":["user","mount","pid","network","ipc"],"type":"object"},"proc_policy":{"additionalProperties":false,"properties":{"hidepid":{"const":2},"mounted":{"const":true},"mqueue_absent":{"const":true},"read_only":{"const":true},"shm_absent":{"const":true}},"required":["mounted","read_only","hidepid","mqueue_absent","shm_absent"],"type":"object"},"profile_sha256":{"$ref":"#/$defs/digest"},"quota_backend":{"additionalProperties":false,"properties":{"enforced":{"const":true},"filesystem_accounting":{"const":true},"kind":{"const":"tmpfs-cgroup-v2"}},"required":["kind","enforced","filesystem_accounting"],"type":"object"},"resource_limit_shape":{"additionalProperties":false,"properties":{"cpu":{"const":"capacity-policy"},"memory":{"const":"capacity-policy"},"pids":{"const":"capacity-policy"},"tmpfs_bytes":{"const":"capacity-policy"},"tmpfs_inodes":{"const":"capacity-policy"}},"required":["memory","pids","cpu","tmpfs_bytes","tmpfs_inodes"],"type":"object"},"schema":{"const":"kilix.content.sandbox-profile/v1"},"seccomp":{"additionalProperties":false,"properties":{"architecture":{"enum":["amd64","arm64","riscv64"]},"default_action":{"const":"allow-except-denied"},"denied_syscalls":{"items":{"$ref":"#/$defs/id"},"maxItems":256,"minItems":21,"type":"array","uniqueItems":true}},"required":["architecture","default_action","denied_syscalls"],"type":"object"}},"required":["schema","id","mounts","namespaces","capabilities","seccomp","devices","proc_policy","resource_limit_shape","quota_backend","profile_sha256"],"title":"Kilix sandbox profile v1","type":"object"}