{"capabilities":[],"devices":["/dev/null","/dev/random","/dev/urandom","/dev/zero"],"id":"sandbox.test","mounts":[{"kind":"bind","nodev":true,"noexec":false,"nosuid":true,"read_only":true,"source_role":"toolchain","target":"/usr"},{"kind":"proc","nodev":true,"noexec":true,"nosuid":true,"read_only":true,"source_role":"proc","target":"/proc"},{"kind":"tmpfs","nodev":true,"noexec":true,"nosuid":true,"read_only":false,"source_role":"scratch","target":"/tmp"}],"namespaces":{"ipc":"fresh","mount":"fresh","network":"fresh","pid":"fresh","user":"fresh"},"proc_policy":{"hidepid":2,"mounted":true,"mqueue_absent":true,"read_only":true,"shm_absent":true},"profile_sha256":"b2372862fa1206f1d0fce9b4f931a595519e53c7afb4a7e24d3ae6f84834864c","quota_backend":{"enforced":true,"filesystem_accounting":true,"kind":"tmpfs-cgroup-v2"},"resource_limit_shape":{"cpu":"capacity-policy","memory":"capacity-policy","pids":"capacity-policy","tmpfs_bytes":"capacity-policy","tmpfs_inodes":"capacity-policy"},"schema":"kilix.content.sandbox-profile/v1","seccomp":{"architecture":"amd64","default_action":"allow-except-denied","denied_syscalls":["ipc","memfd_create","memfd_secret","mq_getsetattr","mq_notify","mq_open","mq_timedreceive","mq_timedsend","mq_unlink","msgctl","msgget","msgrcv","msgsnd","semctl","semget","semop","semtimedop","shmat","shmctl","shmdt","shmget"]}}